[
  {"contract_id":"product.vision","sources":["docs/product/vision.md"],"ownership":"human-maintained","authority":"canonical-documentation"},
  {"contract_id":"project.scope","sources":["docs/product/scope-v0.4.md"],"ownership":"human-maintained","authority":"canonical-documentation"},
  {"contract_id":"architecture.system","sources":["docs/architecture/overview.md","docs/architecture/dependency-rules.md"],"ownership":"human-maintained","authority":"canonical-documentation"},
  {"contract_id":"testing.strategy","sources":["docs/development/testing-strategy.md"],"ownership":"human-maintained","authority":"canonical-documentation"},
  {"contract_id":"security.trust","sources":["docs/security/trust-model.md"],"ownership":"human-maintained","authority":"canonical-documentation"},
  {"contract_id":"installation.lifecycle","sources":["docs/manual/installation.md","docs/manual/uninstallation.md"],"ownership":"human-maintained","authority":"canonical-documentation"},
  {"contract_id":"cli.reference","sources":["docs/reference/cli.md","docs/manual/usage.md"],"ownership":"human-maintained","authority":"canonical-documentation"},
  {"contract_id":"ui.documentation","sources":[],"ownership":"human-maintained","authority":"canonical-documentation"}
]
